{
  "settingId": "spuk_im_schlosskeller",
  "kanonVersion": "1.0.0",
  "titel": "Spuk im Schlosskeller",
  "untertitel": "Das Buffet hinter dicken Mauern",
  "pfade": [
    "ahmet",
    "fatma",
    "olli",
    "can"
  ],
  "kernverdaechtige": [
    "ahmet",
    "fatma",
    "olli",
    "can"
  ],
  "personen": {
    "min": 4,
    "max": 20,
    "hinweis": "Gezählt werden Rollen ohne das Geburtstagskind (B-13)."
  },
  "runden": [
    {
      "nr": 1,
      "name": "Das Alibi-Geflecht",
      "uhrzeit": "00:30",
      "kern": "Alle vier Kernverdächtigen haben gute Gründe, nahe der Theke gewesen zu sein."
    },
    {
      "nr": 2,
      "name": "Die Indizien-Filterung",
      "uhrzeit": "01:15",
      "kern": "Nebendelikte werden von echter Gewalt getrennt."
    },
    {
      "nr": 3,
      "name": "Die finale Gegenüberstellung",
      "uhrzeit": "02:00",
      "kern": "Bei gutem Spiel stehen zwei Restverdächtige dem Schlüsselbeweis gegenüber."
    }
  ],
  "finaleUhrzeit": "02:45",
  "morgenUhrzeit": "07:00",
  "rundendauerMinuten": 30,
  "schwellen": {
    "regel": "wahr, wenn 5 × kooperativ ≥ 3 × Rollen; sonst neutral, wenn 5 × kooperativ ≥ 2 × Rollen; sonst falsche Fährte",
    "wahr": {
      "faktor": 5,
      "gegen": 3
    },
    "neutral": {
      "faktor": 5,
      "gegen": 2
    }
  },
  "enden": {
    "matrix": [
      {
        "id": "ende_meister",
        "name": "Meister-Detektiv",
        "anklage": "richtig",
        "punkteVon": 7,
        "punkteBis": 9
      },
      {
        "id": "ende_teilerfolg",
        "name": "Teilerfolg",
        "anklage": "richtig",
        "punkteVon": 0,
        "punkteBis": 6
      },
      {
        "id": "ende_justizirrtum",
        "name": "Justizirrtum",
        "anklage": "falsch",
        "punkteVon": 4,
        "punkteBis": 9
      },
      {
        "id": "ende_eskalation",
        "name": "Totale Eskalation",
        "anklage": "falsch",
        "punkteVon": 0,
        "punkteBis": 3
      }
    ]
  },
  "regeln": {
    "W-1": "Ein wahrer Bonus-Hinweis liefert einen wahren Baustein, entlastet aber nie allein einen Kernverdächtigen.",
    "S-1": "Resümees nur aus dem Wissen des Detektivs; bei nur einer Restperson kein Name.",
    "D-1": "Optionen mit 0 Punkten zeigen weder Schlüsselbeweis noch Zusatzindiz.",
    "G-1": "Die Option B der Täterrolle (Sabotage) zählt netto −1. Vor der Auflösung wird weder die Qualität des Hinweises noch die Stimmenzahl gezeigt (E-025).",
    "K-1": "Objekte, Marker und Licht auf der Karte sind vor dem Finale in allen Pfaden gleich.",
    "P-1": "Pflichtgespräche geben nur pfadneutrales Wissen preis."
  }
}
